,name,desc,page_id,num_members,page_nr,date_retrieved,age_num,age_word,created_dt,human_num_members
0,r/Home,"Everything home related: interior design, home improvement, architecture.",5_2qs0k,"135,237",0,2023-07-07,14,years,2009,135.2 thousand
1,r/AskReddit,r/AskReddit is the place to ask and answer thought-provoking questions.,5_2qh1i,"41,833,971",0,2023-07-07,15,years,2008,41.8 million
2,r/mildlyinfuriating,jugkfmghgug,5_2ubgg,"5,961,250",0,2023-07-07,11,years,2012,6.0 million
3,r/facepalm,/r/facepalm has gone private in protest of the planned API changes. For more information please read these links: https://www.reddit.com/r/ModCoord/comments/1401qw5/incomplete_and_growing_list_of_participating/ https://www.reddit.com/r/ModCoord/comments/1476fkn/reddit_blackout_2023_save_3rd_party_apps/,5_2r5rp,"7,469,361",0,2023-07-07,13,years,2010,7.5 million
4,r/diablo4,"Welcome to the un official Diablo 4 subreddit! 
The place for fans to discuss news, streams, drops, builds and all things Diablo 4. From character builds, skills to lore and theories, we have it all covered.",5_2rzx9,"746,468",0,2023-07-07,12,years,2011,746.5 thousand
5,r/therewasanattempt,Where all the attempts happen,5_39ne7,"6,551,857",0,2023-07-07,7,years,2016,6.6 million
6,r/AmItheAsshole,"A catharsis for the frustrated moral philosopher in all of us, and a place to finally find out if you were wrong in an argument that's been bothering you. Tell us about any non-violent conflict you have experienced; give us both sides of the story, and find out if you're right, or you're the asshole.  See our Best Of ""Most Controversial"" at /r/AITAFiltered!",5_2xhvq,"8,908,438",0,2023-07-07,10,years,2013,8.9 million
7,r/Damnthatsinteresting,For the most interesting things on the internet,5_2xxyj,"10,568,643",0,2023-07-07,9,years,2014,10.6 million
8,r/worldnews,"A place for major news from around the world, excluding US-internal news.",5_2qh13,"32,238,054",0,2023-07-07,15,years,2008,32.2 million
9,r/WhitePeopleTwitter,People tweeting stuff. We allow tweets from anyone.,5_35n7t,"2,990,755",0,2023-07-07,8,years,2015,3.0 million
10,r/antiwork,"A subreddit for those who want to end work, are curious about ending work, want to get the most out of a work-free life, want more information on anti-work ideas and want personal help with their own jobs/work-related struggles.",5_2y77d,"2,688,501",0,2023-07-07,9,years,2014,2.7 million
11,r/LivestreamFail,The place for all things livestreaming.,5_38jf0,"2,166,140",0,2023-07-07,8,years,2015,2.2 million
12,r/NoStupidQuestions,Ask away!,5_2w844,"3,610,709",0,2023-07-07,10,years,2013,3.6 million
13,r/gaming,The Number One Gaming forum on the Internet.,5_2qh03,"37,375,168",0,2023-07-07,15,years,2008,37.4 million
14,r/leagueoflegends,This is a subreddit devoted to the game League of Legends.,5_2rfxx,"6,454,443",0,2023-07-07,13,years,2010,6.5 million
15,r/funny,Reddit's largest humor depository,5_2qh33,"50,493,959",0,2023-07-07,15,years,2008,50.5 million
16,r/AITAH,"this is a community like r/AmITheAsshole except unlike that subreddit here you can post interpersonal conflicts, anything that's AITA but is not allowed there even posting about Scar from the lion king and trying to convince redditors that he was not the AH. rules: don't berate others and no pornography we have children here",5_446kys,"212,878",0,2023-07-07,2,years,2021,212.9 thousand
17,r/nba,A community for NBA discussion.,5_2qo4s,"7,878,577",0,2023-07-07,14,years,2009,7.9 million
18,r/pics,A place for media featuring John Oliver.,5_2qh0u,"30,088,589",0,2023-07-07,15,years,2008,30.1 million
19,r/news,The place for news articles about current events in the United States and the rest of the world. Discuss it all here.,5_2qh3l,"26,423,066",0,2023-07-07,15,years,2008,26.4 million
20,r/doordash,Unofficial DoorDash Community Subreddit,5_39cye,"286,556",0,2023-07-07,7,years,2016,286.6 thousand
21,r/PublicFreakout,"A subreddit dedicated to people freaking out, melting down, losing their cool, or being weird in public.",5_2yrq6,"4,562,928",0,2023-07-07,9,years,2014,4.6 million
22,r/movies,"The goal of /r/Movies is to provide an inclusive place for discussions and news about films with major releases. Submissions should be for the purpose of informing or initiating a discussion, not just to entertain readers. Read our extensive list of rules for more information on other types of posts like fan-art and self-promotion, or message the moderators if you have any questions.",5_2qh3s,"31,218,690",0,2023-07-07,15,years,2008,31.2 million
23,r/UkraineWarVideoReport,Community Driven Videos/Photos/Updates and Discussion on the Ukrainian War,5_5wjmo8,"693,483",0,2023-07-07,1,year,2022,693.5 thousand
24,r/explainlikeimfive,Explain Like I'm Five is the best forum and archive on the internet for layperson-friendly explanations. Don't Panic!,5_2sokd,"22,423,502",0,2023-07-07,11,years,2012,22.4 million
25,r/politics,/r/Politics is for news and discussion about U.S. politics.,5_2cneq,"8,353,106",0,2023-07-07,15,years,2008,8.4 million
26,r/pcmasterrace,"Welcome to the official subreddit of the PC Master Race / PCMR! All PC related content is welcome, including build help, tech support, and any doubt one might have about PC ownership. You don't necessarily need a PC to be a member of the PCMR. You just have to love PCs. It's not about the hardware in your rig, but the software in your heart! Join us in celebrating and promoting tech, knowledge, and the best gaming and working platform. The PC.",5_2sgp1,"8,016,757",0,2023-07-07,12,years,2011,8.0 million
27,r/Piracy,"⚓ A community devoted to in-depth debate on topics concerning digital piracy, ethical problems, and legal advancements. 𝗣𝗜𝗥𝗔𝗖𝗬 𝗜𝗦 𝗘𝗧𝗛𝗜𝗖𝗔𝗟!",5_2qmox,"1,202,524",0,2023-07-07,14,years,2009,1.2 million
28,r/nextfuckinglevel,A subreddit for gifs and videos that are on another level. ,5_m0bnr,"8,172,280",0,2023-07-07,4,years,2019,8.2 million
29,r/todayilearned,"You learn something new every day; what did you learn today?
Submit interesting and specific facts about something that you just found out here.",5_2qqjc,"32,090,254",0,2023-07-07,14,years,2009,32.1 million
30,r/Minecraft,Minecraft community on reddit,5_2r05i,"7,379,702",0,2023-07-07,14,years,2009,7.4 million
31,r/soccer,"The football subreddit.  News, results and discussion about the beautiful game.",5_2qi58,"4,648,109",0,2023-07-07,15,years,2008,4.6 million
32,r/Genshin_Impact_Leaks,A place to share and discuss leaks and datamines relating to the video game 'Genshin Impact',5_3l2acu,"410,352",0,2023-07-07,2,years,2021,410.4 thousand
33,r/CrazyFuckingVideos,Crazy fucking videos for your viewing pleasure,5_45hae8,"1,851,803",0,2023-07-07,2,years,2021,1.9 million
34,r/Genshin_Impact,"This is the official community for Genshin Impact (原神), the latest open-world action RPG from HoYoverse. The game features a massive, gorgeous map, an elaborate elemental combat system, engaging storyline & characters, co-op game mode, soothing soundtrack, and much more for you to explore!",5_12p4l2,"1,988,609",0,2023-07-07,4,years,2019,2.0 million
35,r/memes,"Memes! A way of describing cultural information being shared.
An element of a culture or system of behavior that may be considered to be passed from one individual to another by nongenetic means, especially imitation.",5_2qjpg,"26,306,377",0,2023-07-07,15,years,2008,26.3 million
36,r/meirl,"you, me, us, irl, reddit style",5_2s5ti,"2,468,805",0,2023-07-07,12,years,2011,2.5 million
37,r/TikTokCringe,"A place to watch the best and worst videos from TikTok. Here you can find TikToks that are cringe-worthy, funny, wholesome, and more! We recommend sorting by flair to find the exact content you're looking for.",5_mvcq5,"1,966,861",0,2023-07-07,4,years,2019,2.0 million
38,r/ukraine,"HERE УКРАЇНА TAKES CENTER STAGE — The purpose of r/Ukraine is to amplify Ukrainian voices. We are at war, so content is tightly moderated to keep our community safe. Share and discuss Україна and her glorious people, history, geography, language, art, culture, values, and experiences during wartime. Sharing of russian narratives in any way, shape or form is banned.",5_2qqcn,"888,664",0,2023-07-07,14,years,2009,888.7 thousand
39,r/Unexpected,This subreddit is for unexpected twists in videos and gifs.,5_2w67q,"10,530,526",0,2023-07-07,10,years,2013,10.5 million
40,r/ChatGPT,Subreddit to discuss about ChatGPT and AI. Not affiliated with OpenAI.,5_7hqomg,"2,340,074",0,2023-07-07,7,months,2022,2.3 million
41,r/CombatFootage,"A forum for combat footage and photos from historical to ongoing wars. Welcome, feel free to join in on any discussion!",5_2v0c6,"1,458,861",0,2023-07-07,10,years,2013,1.5 million
42,r/LifeProTips,Tips that improve your life in one way or another.,5_2s5oq,"22,204,199",0,2023-07-07,12,years,2011,22.2 million
43,r/WTF,"Things that will make others say ""What the F*ck"".",5_2qh61,"7,005,446",0,2023-07-07,15,years,2008,7.0 million
44,r/unpopularopinion,Share your burning hot takes and unpopular opinions!,5_2tk0s,"3,693,355",0,2023-07-07,11,years,2012,3.7 million
45,r/buildapc,Planning on building a computer but need some advice? This is the place to ask! /r/buildapc is a community-driven subreddit dedicated to custom PC assembly. Anyone is welcome to seek the input of our helpful community as they piece together their desktop.,5_2rnve,"6,354,543",0,2023-07-07,13,years,2010,6.4 million
46,r/tifu,r/TIFU means Today I Fucked Up,5_2to41,"18,418,687",0,2023-07-07,11,years,2012,18.4 million
47,r/personalfinance,"Learn about budgeting, saving, getting out of debt, credit, investing, and retirement planning. Join our community, read the PF Wiki, and get on top of your finances!",5_2qstm,"17,895,714",0,2023-07-07,14,years,2009,17.9 million
48,r/shittytattoos,Pictures of shitty tattoos.,5_2tbk2,"474,305",0,2023-07-07,11,years,2012,474.3 thousand
49,r/relationship_advice,"Need help with your relationship? Whether it's romance, friendship, family, co-workers, or basic human interaction: we're here to help!",5_2r0cn,"9,372,855",0,2023-07-07,14,years,2009,9.4 million
50,r/Serverlife,"Server, waiter, waitress? Welcome home, take off your apron, have a glass, and let's chat about work, cause c'mon, as much as you act like you don't wanna talk about it, you do. I know! Check out these related subreddits!
[r/KitchenConfidential](www.reddit.com/r/kitchenconfidential)
/r/chefit
/r/food",5_31zbw,"132,747",0,2023-07-07,9,years,2014,132.7 thousand
51,r/BestofRedditorUpdates,What happened to people who ask reddit for advice or help?  Did they take Reddit's advice? How did it turn out? Read the best updates by redditors and find out what happened after their original post.  Join our discord server: https://discord.gg/Hx2hym2juy,5_2ea6kj,"991,254",0,2023-07-07,3,years,2020,991.3 thousand
52,r/OnePiece,"Welcome to r/OnePiece, the community for Eiichiro Oda's manga and anime series One Piece. From the East Blue to the New World, anything related to the world of One Piece belongs here! If you've just set sail with the Straw Hat Pirates, be wary of spoilers on this subreddit!",5_2rfz5,"2,044,531",0,2023-07-07,13,years,2010,2.0 million
53,r/anime,Reddit's premier anime community.,5_2qh22,"7,420,386",0,2023-07-07,15,years,2008,7.4 million
54,r/TwoXChromosomes,"Welcome to TwoXChromosomes, a subreddit for both serious and silly content, and intended for women's perspectives.   We are a welcoming subreddit and support the rights of all genders. Posts are moderated for respect, equanimity, grace, and relevance.",5_2r2jt,"13,612,286",0,2023-07-07,13,years,2010,13.6 million
55,r/HonkaiStarRail,Honkai: Star Rail is an all-new strategy-RPG title in the Honkai series that takes players on a cosmic adventure across the stars. Hop aboard the Astral Express and experience the galaxy's infinite wonders on this journey filled with adventure and thrill.,5_4q5zoc,"375,502",0,2023-07-07,1,year,2022,375.5 thousand
56,r/ffxiv,"A community for fans of the critically acclaimed MMORPG Final Fantasy XIV, which includes a free trial that includes the entirety of ""A Realm Reborn"" AND the award-winning ""Heavensward"" expansion up to level 60 with no restrictions on playtime. FFXIV's newest expansion, ""Endwalker"", is out now.",5_2rgs7,"808,029",0,2023-07-07,13,years,2010,808.0 thousand
57,r/2007scape,"The community for Old School RuneScape discussion on Reddit. Join us for game discussions, tips and tricks, and all things OSRS!
OSRS is the official legacy version of RuneScape, the largest free-to-play MMORPG.",5_2wbww,"738,244",0,2023-07-07,10,years,2013,738.2 thousand
58,r/wow,World of Warcraft on Reddit!,5_2qio8,"2,348,964",0,2023-07-07,15,years,2008,2.3 million
59,r/wallstreetbets,Like 4chan found a Bloomberg Terminal.,5_2th52,"14,047,803",0,2023-07-07,11,years,2012,14.0 million
60,r/Tinder,"A community for discussing the online dating app Tinder. Sharing conversations, reviewing profiles and more.",5_2w7mz,"5,834,317",0,2023-07-07,10,years,2013,5.8 million
61,r/OldSchoolCool,"/r/OldSchoolCool History's cool kids, looking fantastic! A pictorial and video celebration of history's coolest kids, everything from beatniks to bikers, mods to rude boys, hippies to ravers. And everything in between.  If you've found a photo, or a photo essay, of people from the past looking fantastic, here's the place to share it.",5_2tycb,"18,001,353",0,2023-07-07,11,years,2012,18.0 million
62,r/doordash_drivers,This is an UNOFFICIAL place for DoorDash Drivers to hang out and get to know one another!,5_3h9bt,"226,138",0,2023-07-07,6,years,2017,226.1 thousand
63,r/MadeMeSmile,Welcome! /r/MadeMeSmile is a place to share things that made you smile or brightened up your day. A generally uplifting subreddit.,5_2uqcm,"7,935,085",0,2023-07-07,10,years,2013,7.9 million
64,r/Steam,A subreddit for members of the Steam Community and fans of steam. Discord: discord.gg/steam,5_2qwis,"1,914,029",0,2023-07-07,14,years,2009,1.9 million
65,r/tumblr,"/r/tumblr is your destination for Tumblr related discussions, jokes, screenshots, and more.",5_2r7hk,"1,331,694",0,2023-07-07,13,years,2010,1.3 million
66,r/pcgaming,For PC gaming news and discussion!,5_2qhfg,"3,216,443",0,2023-07-07,15,years,2008,3.2 million
67,r/StupidFood,"A place to lambast idiotic methods of serving food, or any other epicurean inanity worthy of ridicule.",5_37se4,"1,129,824",0,2023-07-07,8,years,2015,1.1 million
68,r/legaladvice,"A place to ask simple legal questions, and to have legal concepts explained.",5_2rawz,"2,382,669",0,2023-07-07,13,years,2010,2.4 million
69,r/manga,"Everything and anything manga!  (manhwa/manhua is okay too!) Discuss weekly chapters, find/recommend a new series to read, post a picture of your collection, lurk, etc!",5_2ql0i,"2,153,634",0,2023-07-07,14,years,2009,2.2 million
70,r/HolUp,"A subreddit for things that make you go ""Hol Up... wait a minute""",5_qir9n,"3,453,767",0,2023-07-07,4,years,2019,3.5 million
71,r/PeterExplainsTheJoke,"Hey gamers, this is the subreddit where you post a meme/joke you don't understand so it can be explained to you. You can also post memes about u/PeterExplainsTheJoke or just post weird pictures of Peter.",5_121h8r,"107,239",0,2023-07-07,4,years,2019,107.2 thousand
72,r/SteamDeck,"Clearly, the best ally money can buy. ",5_4rfocy,"435,931",0,2023-07-07,1,year,2022,435.9 thousand
73,r/StableDiffusion,"/r/StableDiffusion is back open after the protest of Reddit killing open API access, which will bankrupt app developers, hamper moderation, and exclude blind users from the site. More info: https://rtech.support/docs/meta/blackout.html#what-is-going-on Discord: https://discord.gg/4WbTj8YskM Check out our new Lemmy instance: https://lemmy.dbzer0.com/c/stable_diffusion",5_6r4pfl,"356,554",0,2023-07-07,11,months,2022,356.6 thousand
74,r/amiugly,Post your picture here and have fellow Redditors tell you what they think about your appearance!,5_2rgjh,"350,637",0,2023-07-07,13,years,2010,350.6 thousand
75,r/GlobalOffensive,"r/GlobalOffensive is a home for the Counter-Strike: Global Offensive community and a hub for the discussion and sharing of content relevant to CS:GO. Counter-Strike: Global Offensive is a game created by Valve Corporation and released on August 21st, 2012 as a successor to previous games in the series dating back to 1999. The latest installment to the Counter-Strike franchise maintains a healthy, ever-intensifying competitive scene alongside a growing casual playerbase.",5_2sqho,"1,847,339",0,2023-07-07,11,years,2012,1.8 million
76,r/formula1,"Welcome to r/Formula1, the best independent online Formula 1 community!",5_2qimj,"3,210,552",0,2023-07-07,15,years,2008,3.2 million
77,r/ask,This is a place to ask questions.,5_2qhlj,"515,632",0,2023-07-07,15,years,2008,515.6 thousand
78,r/LegalAdviceUK,"LegalAdviceUK exists to provide help for those in need of legal support in England, Scotland, Wales and Northern Ireland. 
We operate as a form of ""legal triage"" where commenters can guide posters towards resolving issues themselves or towards an appropriate professional.",5_32g6u,"815,734",0,2023-07-07,9,years,2014,815.7 thousand
79,r/Games,"The goal of /r/Games is to provide a place for informative and interesting gaming content and discussions. Submissions should be for the purpose of informing or initiating a discussion, not just with the goal of entertaining viewers. Memes, comics, funny screenshots, arts-and-crafts, etc. will be removed.",5_2qhwp,"3,212,353",0,2023-07-07,15,years,2008,3.2 million
80,r/TwoHotTakes,"COPYRIGHT NOTICE: Things posted on this page are for use on Two Hot Takes podcast and accounts.  Subreddit for listeners of the Two Hot Takes Podcast! Here you can post your own write ins, thoughts on the stories shared on the pod, any ideas for future episodes, etc.",5_4hlyni,"184,290",0,2023-07-07,2,years,2021,184.3 thousand
81,r/europe,"r/europe is in restricted mode in continued protest against Reddit's recent policy changes. You will not be able to post or comment. See the pinned post for more details. More information: https://redd.it/13yh0jf/ https://redd.it/147cksa/ Europe: 50 (+6) countries, 230 languages, 746M people… 1 subreddit.",5_2qh4j,"4,611,820",0,2023-07-07,15,years,2008,4.6 million
82,r/Diablo,/r/Diablo is the greatest source for Diablo-related news and discussion on the Internet. Stay awhile and listen.,5_2qore,"471,440",0,2023-07-07,14,years,2009,471.4 thousand
83,r/DnD,"A subreddit dedicated to the various iterations of Dungeons & Dragons, from its First Edition roots to its One D&D future.",5_2r9ei,"3,153,016",0,2023-07-07,13,years,2010,3.2 million
84,r/sysadmin,A reddit dedicated to the profession of Computer System Administration.,5_2qnp7,"804,321",0,2023-07-07,14,years,2009,804.3 thousand
85,r/BrandNewSentence,"For sentences never before written, found in the wild.",5_mbn0j,"1,182,615",0,2023-07-07,4,years,2019,1.2 million
86,r/NonCredibleDefense,Reddit's new home for defense themed shitposts,5_i41xc,"299,180",0,2023-07-07,5,years,2018,299.2 thousand
87,r/popculturechat,"For serious gossips with a great sense of humor. No bores, no bullies. Come for the gossip, stay for the analysis & community.",5_5rj68d,"1,270,028",0,2023-07-07,1,year,2022,1.3 million
88,r/feedthebeast,The subreddit for all things related to Modded Minecraft for Minecraft Java Edition This subreddit was originally created for discussion around the FTB launcher and its modpacks but has since grown to encompass all aspects of modding the Java edition of Minecraft. The /r/feedthebeast subreddit is not affiliated or associated with the Feed the Beast company.,5_2v620,"410,002",0,2023-07-07,10,years,2013,410.0 thousand
89,r/AskMen,Welcome back,5_2s30g,"5,491,486",0,2023-07-07,12,years,2011,5.5 million
90,r/discordapp,"Imagine a Place... where you can belong to a school club, a gaming group, or a worldwide art community. Where just you and handful of friends can spend time together. A place that makes it easy to talk every day and hang out more often.",5_388p4,"1,072,829",0,2023-07-07,8,years,2015,1.1 million
91,r/DotA2,"/r/DotA2 is the most popular English-speaking community to discuss gameplay, esports, and news related to Valve's award winning free-to-play MOBA DotA 2.",5_2s580,"1,203,564",0,2023-07-07,12,years,2011,1.2 million
92,r/Eldenring,"This is the subreddit for the Elden Ring gaming community. Elden Ring is an action RPG which takes place in the Lands Between, sometime after the Shattering of the titular Elden Ring. Players must explore and fight their way through the vast open-world to unite all the shards, restore the Elden Ring, and become Elden Lord. Elden Ring was directed by Hidetaka Miyazaki and made in collaboration with George R. R. Martin. It was developed by FromSoft and published by Bandai Namco.",5_122hf1,"1,985,925",0,2023-07-07,4,years,2019,2.0 million
93,r/MaliciousCompliance,"People conforming to the letter, but not the spirit, of a request.",5_3boqz,"3,716,373",0,2023-07-07,7,years,2016,3.7 million
94,r/Fauxmoi,The Reddit gossip sub.,5_2rqcm8,"924,463",0,2023-07-07,3,years,2020,924.5 thousand
95,r/television,,5_2qh6e,"16,926,100",0,2023-07-07,15,years,2008,16.9 million
96,r/PersonalFinanceCanada,This subreddit is a place to discuss anything related to Canadian personal finance.,5_2tasy,"1,208,852",0,2023-07-07,11,years,2012,1.2 million
97,r/travel,"r/travel is a community about exploring the world. Your pictures, questions, stories, or any good content is welcome.  Clickbait, spam, memes, ads/selling/buying, brochures, classifieds, surveys or self-promotion will be removed.",5_2qh41,"7,912,406",0,2023-07-07,15,years,2008,7.9 million
98,r/FashionReps,"Reddit's largest community for the discussion of replica apparel. We have the most extensive archive of photos & information in the world. Our members are highly skilled in differentiating replicas from authentic products (legit checking), for the purpose of helping others avoid scams. Additionally, we welcome the discussion of replica hobbyism, including reviews, culture, guides, and related discourse. Feel free to request assistance with photos, post a review, or ask our members anything!",5_31hcv,"1,324,942",0,2023-07-07,9,years,2014,1.3 million
99,r/maybemaybemaybe,For those videos that make you think maybe...,5_38e1l,"2,708,928",0,2023-07-07,8,years,2015,2.7 million
